<?xml version="1.0"?>
<pelicula titol="Brazil" minuts="142"  xmlns:xsi="http://www.w3.org/2001/XMLSchema-instance" xsi:noNamespaceSchemaLocation="film.xsd">
    <director>Terry Gilliam</director>
    <repartiment>
       <interpret>Jonathan Pryce</interpret>
       <interpret>Robert De Niro</interpret>
       <interpret>Kim Greist</interpret>
       <interpret>Michael Palin</interpret>
       <interpret>Ian Holm</interpret>
       <interpret>Bob Hoskins</interpret>
    </repartiment>
</pelicula>